{
  "format": "aieng.design_candidate_patch",
  "candidate_id": "candidate_good",
  "reasoning": "Reduce wall and rib thickness to lower volume while keeping within stress limits",
  "variable_changes": [
    {"variable_id": "wall_t", "new_value": 2.5},
    {"variable_id": "rib_t", "new_value": 4.0}
  ]
}
